{"$defs":{"field":{"additionalProperties":false,"properties":{"dataType":{"enum":["STRING","NUMBER","DATE","HOUR"]},"dependencies":{"items":{"type":"string"},"type":"array","uniqueItems":true},"equipmentType":{"enum":["SM_CC","FURNACE","RM4","AP"]},"evidenceFamily":{"enum":["STEEL_CHEMISTRY","CASTING_STABILITY","CHARGE","FUEL_PROFILE","PREHEAT","HEATING","SOAKING","RM4","DIMENSIONS","AP",null]},"featureRole":{"enum":["DIRECT_OPERATION","PRODUCT_STATE_REFERENCE","CONTEXT","EQUIPMENT_IDENTIFIER","IDENTIFIER","TIME","RESULT"]},"field":{"minLength":1,"type":"string"},"firstAvailableStage":{"$ref":"#/$defs/stage"},"sourceColumn":{"type":["string","null"]},"sourceRole":{"enum":["sm_cc","fur_hr","ap",null]}},"required":["field","sourceRole","sourceColumn","dataType","featureRole","equipmentType","firstAvailableStage","evidenceFamily","dependencies"],"type":"object"},"hierarchy":{"additionalProperties":false,"properties":{"equipmentType":{"enum":["SM_CC","FURNACE","RM4","AP"]},"levels":{"items":{"items":{"type":"string"},"type":"array","uniqueItems":true},"minItems":1,"type":"array"}},"required":["equipmentType","levels"],"type":"object"},"stage":{"enum":["CAST_RECORDED","FURNACE_CHARGED","PREHEAT_COMPLETE","HEAT_COMPLETE","SOAK_COMPLETE","FURNACE_EXTRACTED","RM4_RECORDED","AP_RECORDED_WITH_RESULT"]}},"$id":"https://sfep.local/contracts/equipment-monitor/v1/analysis_config.schema.json","$schema":"https://json-schema.org/draft/2020-12/schema","additionalProperties":false,"properties":{"analysisConfigVersion":{"const":"quality-analysis-v1"},"bootstrap":{"additionalProperties":false,"properties":{"minimumValidReplicates":{"const":1900},"replicates":{"const":2000}},"required":["replicates","minimumValidReplicates"],"type":"object"},"evidenceFamilies":{"const":["STEEL_CHEMISTRY","CASTING_STABILITY","CHARGE","FUEL_PROFILE","PREHEAT","HEATING","SOAKING","RM4","DIMENSIONS","AP"]},"fdrFamilies":{"const":["NUMERIC","CATEGORICAL","INTERACTION"]},"fields":{"items":{"$ref":"#/$defs/field"},"minItems":1,"type":"array"},"fixedInteractions":{"items":false,"maxItems":6,"minItems":6,"prefixItems":[{"const":["tundish_temp","mlac_ratio"]},{"const":["f_pre_interval","f_pre_temp"]},{"const":["f_heat_interval","f_heat_temp"]},{"const":["f_sock_interval","f_sock_temp"]},{"const":["rm_pitch","rm4_temp"]},{"const":["ap_line_speed","ap_thick"]}],"type":"array"},"labelMaturityDays":{"const":38},"operatingRanges":{"additionalProperties":false,"properties":{"extremeLowerQuantile":{"const":0.01},"extremeTailMinimumSupport":{"const":2000},"extremeUpperQuantile":{"const":0.99},"minimumSupport":{"const":400},"quantileMethod":{"const":"INVERTED_CDF_TYPE_1"},"typicalLowerQuantile":{"const":0.05},"typicalUpperQuantile":{"const":0.95}},"required":["minimumSupport","extremeTailMinimumSupport","quantileMethod","typicalLowerQuantile","typicalUpperQuantile","extremeLowerQuantile","extremeUpperQuantile"],"type":"object"},"qualityRisk":{"additionalProperties":false,"properties":{"bhQ":{"additionalProperties":false,"properties":{"caution":{"const":0.1},"danger":{"const":0.05}},"required":["caution","danger"],"type":"object"},"confirmationRelativeRisk":{"additionalProperties":false,"properties":{"cautionExclusive":{"const":1},"danger":{"const":1.5}},"required":["cautionExclusive","danger"],"type":"object"},"interactionBins":{"const":3},"minimumCautionDefects":{"const":5},"minimumConfirmationDefects":{"const":5},"minimumConfirmationSupport":{"const":100},"minimumDangerDefects":{"const":10},"minimumDiscoverySupport":{"const":200},"minimumInformativeStrata":{"const":2},"numericBins":{"const":10},"relativeRisk":{"additionalProperties":false,"properties":{"caution":{"const":1.5},"danger":{"const":2}},"required":["caution","danger"],"type":"object"},"riskDifference":{"additionalProperties":false,"properties":{"caution":{"const":5e-3},"danger":{"const":0.01}},"required":["caution","danger"],"type":"object"},"zeroCellCorrection":{"const":0.5}},"required":["minimumDiscoverySupport","minimumCautionDefects","minimumDangerDefects","minimumConfirmationSupport","minimumConfirmationDefects","minimumInformativeStrata","numericBins","interactionBins","zeroCellCorrection","bhQ","relativeRisk","riskDifference","confirmationRelativeRisk"],"type":"object"},"rangeContextHierarchies":{"items":{"$ref":"#/$defs/hierarchy"},"maxItems":4,"minItems":4,"type":"array"},"riskAdjustmentHierarchies":{"items":{"$ref":"#/$defs/hierarchy"},"maxItems":4,"minItems":4,"type":"array"},"schemaVersion":{"const":"sfep-analysis-config/v1"},"splits":{"additionalProperties":false,"properties":{"discoveryFraction":{"const":0.7},"referenceFraction":{"const":0.7}},"required":["referenceFraction","discoveryFraction"],"type":"object"},"timezone":{"const":"Asia/Seoul"},"wilsonZ":{"const":1.959963984540054}},"required":["schemaVersion","analysisConfigVersion","timezone","labelMaturityDays","splits","operatingRanges","qualityRisk","bootstrap","wilsonZ","fields","rangeContextHierarchies","riskAdjustmentHierarchies","fixedInteractions","fdrFamilies","evidenceFamilies"],"type":"object"}
