{"analysisConfigVersion":"quality-analysis-v1","bootstrap":{"minimumValidReplicates":1900,"replicates":2000},"evidenceFamilies":["STEEL_CHEMISTRY","CASTING_STABILITY","CHARGE","FUEL_PROFILE","PREHEAT","HEATING","SOAKING","RM4","DIMENSIONS","AP"],"fdrFamilies":["NUMERIC","CATEGORICAL","INTERACTION"],"fields":[{"dataType":"STRING","dependencies":[],"equipmentType":"SM_CC","evidenceFamily":"CHARGE","featureRole":"EQUIPMENT_IDENTIFIER","field":"sm_plant","firstAvailableStage":"CAST_RECORDED","sourceColumn":"sm_plant","sourceRole":"sm_cc"},{"dataType":"STRING","dependencies":[],"equipmentType":"SM_CC","evidenceFamily":null,"featureRole":"IDENTIFIER","field":"charge_id","firstAvailableStage":"CAST_RECORDED","sourceColumn":"charge_id","sourceRole":"sm_cc"},{"dataType":"STRING","dependencies":[],"equipmentType":"SM_CC","evidenceFamily":"STEEL_CHEMISTRY","featureRole":"CONTEXT","field":"steel_grade","firstAvailableStage":"CAST_RECORDED","sourceColumn":"steel_grade","sourceRole":"sm_cc"},{"dataType":"STRING","dependencies":[],"equipmentType":"SM_CC","evidenceFamily":"STEEL_CHEMISTRY","featureRole":"CONTEXT","field":"steel_usage","firstAvailableStage":"CAST_RECORDED","sourceColumn":"steel_usage","sourceRole":"sm_cc"},{"dataType":"STRING","dependencies":[],"equipmentType":"SM_CC","evidenceFamily":"CASTING_STABILITY","featureRole":"CONTEXT","field":"cc_gubun","firstAvailableStage":"CAST_RECORDED","sourceColumn":"cc_gubun","sourceRole":"sm_cc"},{"dataType":"STRING","dependencies":[],"equipmentType":"SM_CC","evidenceFamily":"DIMENSIONS","featureRole":"CONTEXT","field":"slab_gubun","firstAvailableStage":"CAST_RECORDED","sourceColumn":"slab_gubun","sourceRole":"sm_cc"},{"dataType":"NUMBER","dependencies":[],"equipmentType":"SM_CC","evidenceFamily":"CASTING_STABILITY","featureRole":"DIRECT_OPERATION","field":"tundish_temp","firstAvailableStage":"CAST_RECORDED","sourceColumn":"tundish_temp","sourceRole":"sm_cc"},{"dataType":"NUMBER","dependencies":[],"equipmentType":"SM_CC","evidenceFamily":"CASTING_STABILITY","featureRole":"DIRECT_OPERATION","field":"mlac_ratio","firstAvailableStage":"CAST_RECORDED","sourceColumn":"mlac_ratio","sourceRole":"sm_cc"},{"dataType":"NUMBER","dependencies":[],"equipmentType":"SM_CC","evidenceFamily":"STEEL_CHEMISTRY","featureRole":"PRODUCT_STATE_REFERENCE","field":"delta_ferrite","firstAvailableStage":"CAST_RECORDED","sourceColumn":"delta_ferrite","sourceRole":"sm_cc"},{"dataType":"NUMBER","dependencies":[],"equipmentType":"SM_CC","evidenceFamily":"STEEL_CHEMISTRY","featureRole":"PRODUCT_STATE_REFERENCE","field":"ingre_cr","firstAvailableStage":"CAST_RECORDED","sourceColumn":"ingre_cr","sourceRole":"sm_cc"},{"dataType":"NUMBER","dependencies":[],"equipmentType":"SM_CC","evidenceFamily":"STEEL_CHEMISTRY","featureRole":"PRODUCT_STATE_REFERENCE","field":"ingre_ni","firstAvailableStage":"CAST_RECORDED","sourceColumn":"ingre_ni","sourceRole":"sm_cc"},{"dataType":"NUMBER","dependencies":[],"equipmentType":"SM_CC","evidenceFamily":"STEEL_CHEMISTRY","featureRole":"PRODUCT_STATE_REFERENCE","field":"ingre_s","firstAvailableStage":"CAST_RECORDED","sourceColumn":"ingre_s","sourceRole":"sm_cc"},{"dataType":"NUMBER","dependencies":[],"equipmentType":"SM_CC","evidenceFamily":"DIMENSIONS","featureRole":"PRODUCT_STATE_REFERENCE","field":"slab_grind","firstAvailableStage":"CAST_RECORDED","sourceColumn":"slab_grind","sourceRole":"sm_cc"},{"dataType":"DATE","dependencies":[],"equipmentType":"SM_CC","evidenceFamily":null,"featureRole":"TIME","field":"cast_date","firstAvailableStage":"CAST_RECORDED","sourceColumn":"cast_date","sourceRole":"sm_cc"},{"dataType":"STRING","dependencies":[],"equipmentType":"FURNACE","evidenceFamily":null,"featureRole":"IDENTIFIER","field":"slab_no","firstAvailableStage":"FURNACE_CHARGED","sourceColumn":"slab_no","sourceRole":"fur_hr"},{"dataType":"STRING","dependencies":[],"equipmentType":"FURNACE","evidenceFamily":"CHARGE","featureRole":"EQUIPMENT_IDENTIFIER","field":"furnace_no","firstAvailableStage":"FURNACE_CHARGED","sourceColumn":"furnace_no","sourceRole":"fur_hr"},{"dataType":"STRING","dependencies":[],"equipmentType":"FURNACE","evidenceFamily":"CHARGE","featureRole":"CONTEXT","field":"f_jangip_gubun","firstAvailableStage":"FURNACE_CHARGED","sourceColumn":"f_jangip_gubun","sourceRole":"fur_hr"},{"dataType":"NUMBER","dependencies":[],"equipmentType":"FURNACE","evidenceFamily":"CHARGE","featureRole":"DIRECT_OPERATION","field":"f_jangip_temp","firstAvailableStage":"FURNACE_CHARGED","sourceColumn":"f_jangip_temp","sourceRole":"fur_hr"},{"dataType":"NUMBER","dependencies":[],"equipmentType":"FURNACE","evidenceFamily":"DIMENSIONS","featureRole":"PRODUCT_STATE_REFERENCE","field":"slab_width","firstAvailableStage":"FURNACE_CHARGED","sourceColumn":"slab_width","sourceRole":"fur_hr"},{"dataType":"NUMBER","dependencies":[],"equipmentType":"FURNACE","evidenceFamily":"PREHEAT","featureRole":"DIRECT_OPERATION","field":"f_pre_temp","firstAvailableStage":"PREHEAT_COMPLETE","sourceColumn":"f_pre_temp","sourceRole":"fur_hr"},{"dataType":"NUMBER","dependencies":[],"equipmentType":"FURNACE","evidenceFamily":"PREHEAT","featureRole":"DIRECT_OPERATION","field":"f_pre_interval","firstAvailableStage":"PREHEAT_COMPLETE","sourceColumn":"f_pre_interval","sourceRole":"fur_hr"},{"dataType":"NUMBER","dependencies":[],"equipmentType":"FURNACE","evidenceFamily":"HEATING","featureRole":"DIRECT_OPERATION","field":"f_heat_temp","firstAvailableStage":"HEAT_COMPLETE","sourceColumn":"f_heat_temp","sourceRole":"fur_hr"},{"dataType":"NUMBER","dependencies":[],"equipmentType":"FURNACE","evidenceFamily":"HEATING","featureRole":"DIRECT_OPERATION","field":"f_heat_interval","firstAvailableStage":"HEAT_COMPLETE","sourceColumn":"f_heat_interval","sourceRole":"fur_hr"},{"dataType":"NUMBER","dependencies":[],"equipmentType":"FURNACE","evidenceFamily":"SOAKING","featureRole":"DIRECT_OPERATION","field":"f_sock_temp","firstAvailableStage":"SOAK_COMPLETE","sourceColumn":"f_sock_temp","sourceRole":"fur_hr"},{"dataType":"NUMBER","dependencies":[],"equipmentType":"FURNACE","evidenceFamily":"SOAKING","featureRole":"DIRECT_OPERATION","field":"f_sock_interval","firstAvailableStage":"SOAK_COMPLETE","sourceColumn":"f_sock_interval","sourceRole":"fur_hr"},{"dataType":"NUMBER","dependencies":[],"equipmentType":"FURNACE","evidenceFamily":"FUEL_PROFILE","featureRole":"DIRECT_OPERATION","field":"f_bfg","firstAvailableStage":"FURNACE_EXTRACTED","sourceColumn":"f_bfg","sourceRole":"fur_hr"},{"dataType":"NUMBER","dependencies":[],"equipmentType":"FURNACE","evidenceFamily":"FUEL_PROFILE","featureRole":"DIRECT_OPERATION","field":"f_cog","firstAvailableStage":"FURNACE_EXTRACTED","sourceColumn":"f_cog","sourceRole":"fur_hr"},{"dataType":"NUMBER","dependencies":[],"equipmentType":"FURNACE","evidenceFamily":"FUEL_PROFILE","featureRole":"DIRECT_OPERATION","field":"f_ldg","firstAvailableStage":"FURNACE_EXTRACTED","sourceColumn":"f_ldg","sourceRole":"fur_hr"},{"dataType":"NUMBER","dependencies":["f_bfg","f_cog","f_ldg"],"equipmentType":"FURNACE","evidenceFamily":"FUEL_PROFILE","featureRole":"DIRECT_OPERATION","field":"f_bfg_ratio","firstAvailableStage":"FURNACE_EXTRACTED","sourceColumn":null,"sourceRole":null},{"dataType":"NUMBER","dependencies":["f_bfg","f_cog","f_ldg"],"equipmentType":"FURNACE","evidenceFamily":"FUEL_PROFILE","featureRole":"DIRECT_OPERATION","field":"f_cog_ratio","firstAvailableStage":"FURNACE_EXTRACTED","sourceColumn":null,"sourceRole":null},{"dataType":"NUMBER","dependencies":["f_bfg","f_cog","f_ldg"],"equipmentType":"FURNACE","evidenceFamily":"FUEL_PROFILE","featureRole":"DIRECT_OPERATION","field":"f_ldg_ratio","firstAvailableStage":"FURNACE_EXTRACTED","sourceColumn":null,"sourceRole":null},{"dataType":"DATE","dependencies":[],"equipmentType":"FURNACE","evidenceFamily":null,"featureRole":"TIME","field":"f_ext_date","firstAvailableStage":"FURNACE_EXTRACTED","sourceColumn":"f_ext_date","sourceRole":"fur_hr"},{"dataType":"HOUR","dependencies":[],"equipmentType":"FURNACE","evidenceFamily":null,"featureRole":"TIME","field":"f_ext_time","firstAvailableStage":"FURNACE_EXTRACTED","sourceColumn":"f_ext_time","sourceRole":"fur_hr"},{"dataType":"STRING","dependencies":[],"equipmentType":"RM4","evidenceFamily":null,"featureRole":"IDENTIFIER","field":"hr_coil_id","firstAvailableStage":"RM4_RECORDED","sourceColumn":"hr_coil_id","sourceRole":"fur_hr"},{"dataType":"DATE","dependencies":[],"equipmentType":"RM4","evidenceFamily":null,"featureRole":"TIME","field":"hr_date","firstAvailableStage":"RM4_RECORDED","sourceColumn":"hr_date","sourceRole":"fur_hr"},{"dataType":"NUMBER","dependencies":[],"equipmentType":"RM4","evidenceFamily":"DIMENSIONS","featureRole":"PRODUCT_STATE_REFERENCE","field":"hr_thick","firstAvailableStage":"RM4_RECORDED","sourceColumn":"hr_thick","sourceRole":"fur_hr"},{"dataType":"NUMBER","dependencies":[],"equipmentType":"RM4","evidenceFamily":"DIMENSIONS","featureRole":"PRODUCT_STATE_REFERENCE","field":"hr_width","firstAvailableStage":"RM4_RECORDED","sourceColumn":"hr_width","sourceRole":"fur_hr"},{"dataType":"NUMBER","dependencies":[],"equipmentType":"RM4","evidenceFamily":"RM4","featureRole":"DIRECT_OPERATION","field":"rm4_temp","firstAvailableStage":"RM4_RECORDED","sourceColumn":"rm4_temp","sourceRole":"fur_hr"},{"dataType":"NUMBER","dependencies":[],"equipmentType":"RM4","evidenceFamily":"RM4","featureRole":"DIRECT_OPERATION","field":"rm_pitch","firstAvailableStage":"RM4_RECORDED","sourceColumn":"rm_pitch","sourceRole":"fur_hr"},{"dataType":"STRING","dependencies":[],"equipmentType":"AP","evidenceFamily":"AP","featureRole":"EQUIPMENT_IDENTIFIER","field":"ap_plant","firstAvailableStage":"AP_RECORDED_WITH_RESULT","sourceColumn":"ap_plant","sourceRole":"ap"},{"dataType":"STRING","dependencies":[],"equipmentType":"AP","evidenceFamily":null,"featureRole":"IDENTIFIER","field":"ap_prod_id","firstAvailableStage":"AP_RECORDED_WITH_RESULT","sourceColumn":"ap_prod_id","sourceRole":"ap"},{"dataType":"DATE","dependencies":[],"equipmentType":"AP","e